,speech_id,date,period,speaker,party,text,text_tokenised,agenda,speechnumber,chair,MEP,commission
123,eu9_26329,2022-10-17,9,Sylvia Limmer,ID,"Herr Präsident, verehrte Kollegen! Im Zuge von Green Deal, Klimagesetz und Fit-für-55-Paket möchte Brüssel nun also auch darüber bestimmen, welche Kraftstoffe für den freien Personenverkehr in Zukunft erlaubt sein sollen.",", verehrte ! Zuge Green Deal , Klimagesetz Fit-für-55-Paket Brüssel bestimmen , Kraftstoffe freien Personenverkehr Zukunft erlaubt .",14. Sustainable maritime fuels (FuelEU Maritime Initiative) - Deployment of alternative fuels infrastructure (debate),29,False,True,False
124,eu9_26329,2022-10-17,9,Sylvia Limmer,ID,"Das jüngste ökosozialistische Klima-Ei, das kurz vor dem finalen Legen in Brüssel steht, ist das EU—weite Verbot von Verbrennungsmotoren. Ende Oktober soll es eingetütet werden. Und weil es nach wie vor an einer geeigneten Infrastruktur fehlt, schiebt man nun eine Verordnung hinterher, die das regeln soll.","jüngste ökosozialistische Klima-Ei , finalen Legen Brüssel steht , EU—weite Verbot Verbrennungsmotoren . Oktober eingetütet . geeigneten Infrastruktur fehlt , schiebt Verordnung hinterher , regeln .",14. Sustainable maritime fuels (FuelEU Maritime Initiative) - Deployment of alternative fuels infrastructure (debate),29,False,True,False
125,eu9_26647,2022-10-05,9,Nicolaus Fest,ID,"Und wer den extrem prorussischen antiukrainischen Artikel gelesen hat, den Greenpeace kürzlich nach scharfen Protesten löschen musste, kann tatsächlich auf den Gedanken kommen, dass auch Greenpeace zu den Helfershelfern Putins gehört. Vielleicht werden auch Fridays for Future und Greta Thunberg von Putin finanziert.","extrem prorussischen antiukrainischen Artikel gelesen , Greenpeace kürzlich scharfen Protesten löschen , tatsächlich Gedanken , Greenpeace Helfershelfern Putins gehört . Fridays for Future Greta Thunberg Putin finanziert .",6. Countering the anti-European and anti-Ukrainian propaganda of Putin’s European cronies (topical debate),24,False,True,False
126,eu9_27463,2022-10-03,9,Joachim Kuhs,ID,"Wir leben wahrlich in turbulenten Zeiten, und es besteht die Gefahr, dass wir vor lauter Angst vor einem Weltkrieg oder vor einer neuen Pandemie oder vor den Ideologen und Priestern der neuen Klimareligion wirklich wichtige Probleme, insbesondere das Schicksal der Menschen, aus den Augen verlieren, die wegen ihres Glaubens verfolgt werden.","leben wahrlich turbulenten Zeiten , besteht Gefahr , lauter Angst Weltkrieg Pandemie Ideologen Priestern Klimareligion wichtige Probleme , insbesondere Schicksal Menschen , Augen verlieren , Glaubens verfolgt .",13. The EU's actions in the field of freedom of religion or belief worldwide (debate),10,False,True,False
127,eu9_27674,2022-09-14,9,Gunnar Beck,ID,"Unsere Stagflation ist also nicht Folge von COVID oder Ukrainekrieg, sondern hausgemacht durch undurchdachte Sanktionen und einen Green Deal, der Energie unbezahlbar macht und null Einfluss auf das Weltklima hat. Jetzt soll der EU-Migrationspakt noch dutzende Millionen Migranten zu uns holen.","Stagflation Folge COVID Ukrainekrieg , hausgemacht undurchdachte Sanktionen Green Deal , Energie unbezahlbar null Einfluss Weltklima . EU-Migrationspakt dutzende Millionen Migranten holen .",2. State of the Union (debate),25,False,True,False
128,eu9_27897,2022-09-14,9,Gunnar Beck,ID,"Bulgarien mag korrupt sein, aber seine neue Regierung ist strikt auf EU-Kurs und fügt sich der irrsinnigen Klima- und Pro-Migrationsagenda, im Gegensatz zu Ungarn und Polen, die die Interessen der eigenen Bevölkerung vertreten und lieber die Wirtschaft schützen, als wie Sisyphos Klimagipfel zu erklimmen.","Bulgarien korrupt , Regierung strikt EU-Kurs fügt irrsinnigen Klima- Pro-Migrationsagenda , Gegensatz Ungarn Polen , Interessen Bevölkerung vertreten Wirtschaft schützen , Sisyphos Klimagipfel erklimmen .",14. Illegal detention of the opposition leader in Bulgaria (topical debate),8,False,True,False
129,eu9_28174,2022-09-13,9,Markus Buchheit,ID,"Wir haben Abschlagszahlungen mittlerweile, die 200 bis 600 % höher sind als im letzten Jahr im Energiebereich. Das Problem der Teuerung, das war gerade hervorgebracht durch die fehlgeleitete Energiewende, das war gerade hervorgebracht durch zu viel grüne Energie, die eben unsere Netze belastet, die eben Flatterstrom bedeutet im Endeffekt.","Abschlagszahlungen mittlerweile , 200 600   % höher letzten Energiebereich . Problem Teuerung , hervorgebracht fehlgeleitete Energiewende , hervorgebracht grüne Energie , Netze belastet , Flatterstrom bedeutet Endeffekt .",10. Renewable Energy Directive (debate),18,False,True,False
130,eu9_28287,2022-09-13,9,Guido Reil,ID,"Wer gleichzeitig aus der Kohle und aus der Atomenergie aussteigt und als einzige grundlastfähige Energie auf russisches billiges Gas setzt, der sollte besser keine Sanktionen gegen Russland verhängen. Sanktionen, die der Ukraine nicht helfen. Sanktionen, die Russland massiv nutzen – das verdient sich gerade dumm und dämlich.","gleichzeitig Kohle Atomenergie aussteigt einzige grundlastfähige Energie russisches billiges Gas setzt , Sanktionen Russland verhängen . Sanktionen , Ukraine helfen . Sanktionen , Russland massiv nutzen – verdient dumm dämlich .",15. EU response to the increase in energy prices in Europe (debate),24,False,True,False
131,eu9_28287,2022-09-13,9,Guido Reil,ID,"Und Sanktionen, die unser Land, Deutschland, kaputtmachen. Was wir brauchen, ist eine Renaissance der Kohle, eine Renaissance der Atomkraft. Und wir brauchen den Ausstieg aus dem Grünen Deal für sichere Energie und für sozialen Frieden und für Wohlstand für uns alle.","Sanktionen , Land , Deutschland , kaputtmachen . brauchen , Renaissance Kohle , Renaissance Atomkraft . brauchen Ausstieg Grünen Deal sichere Energie sozialen Frieden Wohlstand .",15. EU response to the increase in energy prices in Europe (debate),24,False,True,False
132,eu9_28764,2022-07-07,9,Joachim Kuhs,ID,"Belassen wir es doch einfach beim Status quo. Wenn die Menschen wegen der Regeln nicht mehr gerne Rad fahren, dann bewirken Sie mit ihrer Regulierung genau das Gegenteil. Dann wird übrigens kein Gramm CO2 eingespart.","Belassen einfach Status quo . Menschen Regeln gerne Rad fahren , bewirken Regulierung genau Gegenteil . Gramm CO2 eingespart .",12. Developing an EU Cycling Strategy (debate),9,False,True,False
133,eu9_29291,2022-07-05,9,Guido Reil,ID,"Herr Präsident, liebe Kolleginnen und Kollegen! Die Kommission möchte die Sozialwirtschaft stärken. Das ist grundsätzlich richtig. Aber geht es darum, die Sozialwirtschaft sozialer zu machen, menschlicher zu machen, zum Beispiel die Arbeitsbedingungen der Pflegekräfte zu verbessern? Nein. Die Kommission möchte die Pflege klimaneutral gestalten.",", liebe Kolleginnen ! Kommission Sozialwirtschaft stärken . grundsätzlich . , Sozialwirtschaft sozialer , menschlicher , Arbeitsbedingungen Pflegekräfte verbessern ? . Kommission Pflege klimaneutral gestalten .",9. EU action plan for the social economy (debate),13,False,True,False
134,eu9_29445,2022-07-05,9,Gunnar Beck,ID,"Der EU Green Deal und das Programm Fit for 55 sehen vor, dass die EU bis 2050 klimaneutral werden muss. Das wird natürlich seine Folgen für Investitionen haben. Europäische Finanzinstitute und Unternehmen werden massiv in nachhaltige Technologien investieren müssen. Aber wer entscheidet, was nachhaltig ist und was nicht?","EU Green Deal Programm Fit for 55 sehen , EU 2050 klimaneutral . Folgen Investitionen . Europäische Finanzinstitute Unternehmen massiv nachhaltige Technologien investieren . entscheidet , nachhaltig ?",14. Objection pursuant to Rule 111(3): Amending the Taxonomy Climate Delegated Act and the Taxonomy Disclosures Delegated Act (debate),86,False,True,False
135,eu9_29445,2022-07-05,9,Gunnar Beck,ID,"Hier kommt die EU-Taxonomie ins Spiel: Sie klassifiziert alle möglichen Wirtschaftstätigkeiten in der EU nach ihrer ökologischen Nachhaltigkeit. Die Kommission schlug vor, Gas und Kernenergie als Übergangsenergiequellen zur Erreichung der CO2-Neutralität in die Taxonomie aufzunehmen.","EU-Taxonomie Spiel : klassifiziert möglichen Wirtschaftstätigkeiten EU ökologischen Nachhaltigkeit . Kommission schlug , Gas Kernenergie Übergangsenergiequellen Erreichung CO2-Neutralität Taxonomie aufzunehmen .",14. Objection pursuant to Rule 111(3): Amending the Taxonomy Climate Delegated Act and the Taxonomy Disclosures Delegated Act (debate),86,False,True,False
136,eu9_30317,2022-06-09,9,Joachim Kuhs,ID,"Und so geht es weiter: Mit den Totschlagbegriffen Klima oder Biodiversität sollen noch mehr Waldflächen unter Schutz gestellt werden und so der seit Generationen erfolgreichen nachhaltigen Bewirtschaftung entzogen werden. Der Holzeinschlag müsse reduziert werden, wird gesagt, um Klimaschutzziele und den Green Deal zu erfüllen.",": Totschlagbegriffen Klima Biodiversität Waldflächen Schutz gestellt Generationen erfolgreichen nachhaltigen Bewirtschaftung entzogen . Holzeinschlag müsse reduziert , , Klimaschutzziele Green Deal erfüllen .",9. Illegal logging in the EU (debate),6,False,True,False
137,eu9_30765,2022-06-07,9,Sylvia Limmer,ID,"Man will ihn bei Konsum- und Mobilitätsmustern [sic] umerziehen, mit Verboten und massiver CO2-Bepreisung, die – welch Wunder – als Folge schon jetzt zu explodierenden Preisen geführt hat.","Konsum- Mobilitätsmustern [ sic ] umerziehen , Verboten massiver CO2-Bepreisung ,   – welch Wunder – Folge explodierenden Preisen geführt .",2. Revision of the EU Emissions Trading System - Social Climate Fund - Carbon border adjustment mechanism - Revision of the EU Emissions Trading System for aviation - Notification under the Carbon Offsetting and Reduction Scheme for International Aviation (CORSIA) (joint debate – Fit for 55 (part 1)),52,False,True,False
138,eu9_30765,2022-06-07,9,Sylvia Limmer,ID,"Der Gipfel der Idiotie und Ideologie ist erreicht, wenn man dem besteuerten Bürger gnädig einen winzigen Teil der abgepressten CO2‑Zwangserziehungsabgabe in Form eines Klima-Sozialfonds – politisches Wohlverhalten vorausgesetzt – überlässt, um dessen herbeigeführte Energiearmut zu lindern.","Gipfel Idiotie Ideologie erreicht , besteuerten Bürger gnädig winzigen abgepressten CO2‑Zwangserziehungsabgabe Form Klima-Sozialfonds   – politisches Wohlverhalten vorausgesetzt – überlässt , herbeigeführte Energiearmut lindern .",2. Revision of the EU Emissions Trading System - Social Climate Fund - Carbon border adjustment mechanism - Revision of the EU Emissions Trading System for aviation - Notification under the Carbon Offsetting and Reduction Scheme for International Aviation (CORSIA) (joint debate – Fit for 55 (part 1)),52,False,True,False
139,eu9_30804,2022-06-07,9,Guido Reil,ID,"Frau Präsidentin, liebe Kolleginnen und Kollegen! Wir reden heute über den Europäischen Klima-Sozialfonds. Das heißt, wir reden über die Folgen des Green Deal für die Menschen.",", liebe Kolleginnen ! reden Europäischen Klima-Sozialfonds . , reden Folgen Green Deal Menschen .",2. Revision of the EU Emissions Trading System - Social Climate Fund - Carbon border adjustment mechanism - Revision of the EU Emissions Trading System for aviation - Notification under the Carbon Offsetting and Reduction Scheme for International Aviation (CORSIA) (joint debate – Fit for 55 (part 1)),91,False,True,False
140,eu9_30804,2022-06-07,9,Guido Reil,ID,"Angesichts der Krise wissen wir doch: Wir brauchen eine sichere und bezahlbare Energie, und die kommt aus Kohle und der Atomkraft. Wir brauchen eine Renaissance von Kohle und Atomkraft, und der Green Deal gehört auf den Müll.","Angesichts Krise wissen : brauchen sichere bezahlbare Energie , Kohle Atomkraft . brauchen Renaissance Kohle Atomkraft , Green Deal gehört Müll .",2. Revision of the EU Emissions Trading System - Social Climate Fund - Carbon border adjustment mechanism - Revision of the EU Emissions Trading System for aviation - Notification under the Carbon Offsetting and Reduction Scheme for International Aviation (CORSIA) (joint debate – Fit for 55 (part 1)),91,False,True,False
141,eu9_30916,2022-06-07,9,Sylvia Limmer,ID,"Man ignoriert nicht nur die Emissionen bei der Betankung, sondern auch den ganz erheblichen CO2‑Rucksack aller Traktionsbatterien, der anfällt bei der Produktion oder dem energieintensiven Recycling. Und woher soll er kommen, der Strom?","ignoriert Emissionen Betankung , erheblichen CO2‑Rucksack Traktionsbatterien , anfällt Produktion energieintensiven Recycling . woher , Strom ?","7. Binding annual greenhouse gas emission reductions by Member States (Effort Sharing Regulation) - Land use, land use change and forestry (LULUCF) - CO2 emission standards for cars and vans (joint debate – Fit for 55 (part 2))",60,False,True,False
142,eu9_30916,2022-06-07,9,Sylvia Limmer,ID,"Man ignoriert die fehlende Ladeinfrastruktur, man ignoriert Warnungen aus Wirtschaft, Industrie, Technik und Lehre und beharrt stattdessen in einer einseitig politischen Festlegung auf Elektromobilität, die die CO2-Emissionen in naher Zukunft nicht reduzieren wird, weil dahinter längst der Gedanke der Abschaffung der individuellen Mobilität als","ignoriert fehlende Ladeinfrastruktur , ignoriert Warnungen Wirtschaft , Industrie , Technik Lehre beharrt stattdessen einseitig politischen Festlegung Elektromobilität , CO2-Emissionen naher Zukunft reduzieren , längst Gedanke Abschaffung individuellen Mobilität","7. Binding annual greenhouse gas emission reductions by Member States (Effort Sharing Regulation) - Land use, land use change and forestry (LULUCF) - CO2 emission standards for cars and vans (joint debate – Fit for 55 (part 2))",60,False,True,False
143,eu9_30940,2022-06-07,9,Gunnar Beck,ID,"Das EU-Parlament fordert die Kommission und die Mitgliedstaaten auf, ihre Anstrengungen zur Erreichung der Klimaneutralität bis 2050 zu intensivieren. Fakt ist, dass seit dem Jahr 2010 die CO2-Emissionen in der EU um 14 % gesunken sind, während die globalen Emissionen um 11 % zugenommen haben.","EU-Parlament fordert Kommission Mitgliedstaaten , Anstrengungen Erreichung Klimaneutralität 2050 intensivieren . Fakt , 2010 CO2-Emissionen EU 14   % gesunken , globalen Emissionen 11   % zugenommen .","7. Binding annual greenhouse gas emission reductions by Member States (Effort Sharing Regulation) - Land use, land use change and forestry (LULUCF) - CO2 emission standards for cars and vans (joint debate – Fit for 55 (part 2))",84,False,True,False
144,eu9_30940,2022-06-07,9,Gunnar Beck,ID,"Im Jahr 2010 lag der Anteil der EU an den weltweiten Treibhausgasemissionen bei über 10 %, heute liegt er bei 8,6 %. Zeitgleich sind aber zwischen 2010 und 2019 die chinesischen CO2-Emissionen um 21 % gestiegen.","2010 lag Anteil EU weltweiten Treibhausgasemissionen 10   % , liegt 8,6   % . Zeitgleich 2010 2019 chinesischen CO2-Emissionen 21   % gestiegen .","7. Binding annual greenhouse gas emission reductions by Member States (Effort Sharing Regulation) - Land use, land use change and forestry (LULUCF) - CO2 emission standards for cars and vans (joint debate – Fit for 55 (part 2))",84,False,True,False
145,eu9_30940,2022-06-07,9,Gunnar Beck,ID,"Chinas Anteil an den weltweiten CO2-Emissionen ist also von 27,5 % auf 30 % gestiegen und wird voraussichtlich im nächsten Jahrzehnt noch weiter steigen. Auch die Emissionen in anderen sogenannten Entwicklungsländern nehmen stetig zu.","Chinas Anteil weltweiten CO2-Emissionen 27,5   % 30   % gestiegen voraussichtlich nächsten Jahrzehnt steigen . Emissionen sogenannten Entwicklungsländern nehmen stetig .","7. Binding annual greenhouse gas emission reductions by Member States (Effort Sharing Regulation) - Land use, land use change and forestry (LULUCF) - CO2 emission standards for cars and vans (joint debate – Fit for 55 (part 2))",84,False,True,False
146,eu9_30940,2022-06-07,9,Gunnar Beck,ID,"Schlussfolgerung: Selbst wenn eine sich de-entwickelnde EU die Klimaneutralität bis 2050 erreicht, so werden sich die weltweiten CO2-Emissionen bis dahin trotzdem verdoppelt haben.","Schlussfolgerung : de-entwickelnde EU Klimaneutralität 2050 erreicht , weltweiten CO2-Emissionen verdoppelt .","7. Binding annual greenhouse gas emission reductions by Member States (Effort Sharing Regulation) - Land use, land use change and forestry (LULUCF) - CO2 emission standards for cars and vans (joint debate – Fit for 55 (part 2))",84,False,True,False
147,eu9_30940,2022-06-07,9,Gunnar Beck,ID,"Wenn die EU den Klimawandel ernst nehmen würde, so müsste sie den privilegierten Status (non-Annex 1 Status) der sogenannten „Entwicklungsländer“, einschließlich China, abschaffen, der diese von verbindlichen Emissionsreduktionszielen befreit.","EU Klimawandel ernst nehmen , müsste privilegierten Status ( non-Annex 1 Status ) sogenannten „ Entwicklungsländer “ , einschließlich China , abschaffen , verbindlichen Emissionsreduktionszielen befreit .","7. Binding annual greenhouse gas emission reductions by Member States (Effort Sharing Regulation) - Land use, land use change and forestry (LULUCF) - CO2 emission standards for cars and vans (joint debate – Fit for 55 (part 2))",84,False,True,False
148,eu9_31015,2022-06-07,9,Bernhard Zimniok,ID,"Gerade die massiv gestiegenen Energiepreise sorgen in Deutschland dafür, dass die sowieso schon enorm hohen Kosten der völlig fehlgeleiteten Energiewende noch deutlich höher ausfallen.","massiv gestiegenen Energiepreise sorgen Deutschland , sowieso enorm hohen Kosten völlig fehlgeleiteten Energiewende deutlich höher ausfallen .","10. The EU’s Foreign, Security and Defence Policy after the Russian invasion of Ukraine (debate)",16,False,True,False
149,eu9_31051,2022-06-07,9,Nicolaus Fest,ID,"Eigentlich, wie gesagt, geht es um Sicherheits- und Verteidigungspolitik. Aber im Antrag geht es auch um Zivilgesellschaft, angebliche Bekämpfung von Desinformation und natürlich um die Rettung des Klimas. Dafür will man einen Klimafonds einrichten. Was aber hat ein Klimafonds mit Sicherheits- und Verteidigungspolitik zu tun?","Eigentlich , , Sicherheits- Verteidigungspolitik . Antrag Zivilgesellschaft , angebliche Bekämpfung Desinformation Rettung Klimas . Klimafonds einrichten . Klimafonds Sicherheits- Verteidigungspolitik ?",12. Security in the Eastern Partnership area and the role of the common security and defence policy (debate),8,False,True,False
150,eu9_31152,2022-06-06,9,Bernhard Zimniok,ID,"Während früher Sun Tzu und Clausewitz gelehrt wurden, soll jetzt stattdessen die Klimaideologie im Verteidigungsbereich Einzug halten. Wenig überraschend scheitert der Bericht daher auch am Realitätscheck.","Sun Tzu Clausewitz gelehrt , stattdessen Klimaideologie Verteidigungsbereich Einzug halten . überraschend scheitert Bericht Realitätscheck .",16. The EEAS’s Climate Change and Defence Roadmap (debate),7,False,True,False
151,eu9_31152,2022-06-06,9,Bernhard Zimniok,ID,"Die Kernaufgabe des Militärs, durch Abschreckung und Stärke die Sicherheit eines Landes zu gewährleisten, wird durch die in diesem Bericht genannten Forderungen komplett torpediert. Eine davon lautet ernsthaft, dass der Ausbau einer Armee nicht zu einer erhöhten CO2-Belastung führen darf.","Kernaufgabe Militärs , Abschreckung Stärke Sicherheit Landes gewährleisten , Bericht genannten Forderungen komplett torpediert . lautet ernsthaft , Ausbau Armee erhöhten CO2-Belastung führen .",16. The EEAS’s Climate Change and Defence Roadmap (debate),7,False,True,False
152,eu9_31152,2022-06-06,9,Bernhard Zimniok,ID,"Ein Leopard 2 – ein Panzer, für die, die es nicht wissen – schluckt auch weiterhin 530 Liter Diesel pro Stunde oder pro 100 km, sorry. Soll dann lieber ein Panzer gekauft werden, der nicht den Ansprüchen genügt, aber dafür weniger verbraucht, weniger CO2 ausstößt? Welch ein Wahnsinn.","Leopard   2   – Panzer , , wissen   – schluckt weiterhin 530   Liter Diesel pro Stunde pro 100   km , sorry . Panzer gekauft , Ansprüchen genügt , verbraucht , CO2 ausstößt ? Welch Wahnsinn .",16. The EEAS’s Climate Change and Defence Roadmap (debate),7,False,True,False
153,eu9_31152,2022-06-06,9,Bernhard Zimniok,ID,"Wenn wir aus zukünftigen Krisen oder gar Kriegen siegreich hervorgehen wollen, brauchen wir eine bessere Strategie, Ausrüstung und Kampfkraft und nicht die bessere CO2-Bilanz.","zukünftigen Krisen Kriegen siegreich hervorgehen , brauchen bessere Strategie , Ausrüstung Kampfkraft bessere CO2-Bilanz .",16. The EEAS’s Climate Change and Defence Roadmap (debate),7,False,True,False
154,eu9_31303,2022-06-06,9,Gunnar Beck,ID,Frau Präsidentin! Aufforstung der Erdoberfläche ist laut einer Studie der Technischen Hochschule Zürich die wirksamste Maßnahme zur Klimarettung. Ein Drittel mehr Waldfläche weltweit würde zwei Drittel des industriell erzeugten Kohlenstoffs absorbieren. Deutschland ist mit 32 % Forstfläche auf Platz 21 der EU.,! Aufforstung Erdoberfläche laut Studie Technischen Hochschule Zürich wirksamste Maßnahme Klimarettung . Drittel Waldfläche weltweit Drittel industriell erzeugten Kohlenstoffs absorbieren . Deutschland 32   % Forstfläche Platz   21 EU .,21. One-minute speeches on matters of political importance,13,False,True,False
155,eu9_31303,2022-06-06,9,Gunnar Beck,ID,Mit 10 Prozentpunkten Aufforstung könnten Deutschland und die EU ihren Beitrag zur Klimarettung leisten. Stattdessen erzwingt die EU die grüne Transformation und Deindustrialisierung. Mit Anteilen von jeweils 2 und 8 % an den weltweiten CO2‑Emissionen ist unser Einfluss auf das Weltklima gleich Null.,10   Prozentpunkten Aufforstung könnten Deutschland EU Beitrag Klimarettung leisten . Stattdessen erzwingt EU grüne Transformation Deindustrialisierung . Anteilen jeweils 2 8   % weltweiten CO2‑Emissionen Einfluss Weltklima Null .,21. One-minute speeches on matters of political importance,13,False,True,False
156,eu9_31303,2022-06-06,9,Gunnar Beck,ID,"Das Ergebnis kann daher nicht die Klimarettung, sondern nur das Ende unserer Wettbewerbsfähigkeit sein. Sie wollen dies, denn sonst sprächen Sie hier auch über Aufforstung.","Ergebnis Klimarettung , Wettbewerbsfähigkeit . , sprächen Aufforstung .",21. One-minute speeches on matters of political importance,13,False,True,False
157,eu9_31347,2022-05-19,9,Guido Reil,ID,"Sie haben den Menschen eingeredet, dass der Klimawandel das Ende der Welt bedeutet. Über Dreiviertel aller jungen Leute sind deswegen besorgt, fast die Hälfte sogar so sehr, dass sie sich in ihrem Alltagsleben beeinträchtigt fühlen. Für Sie ist das praktisch.","Menschen eingeredet , Klimawandel Welt bedeutet . Dreiviertel jungen Leute besorgt , fast Hälfte sogar , Alltagsleben beeinträchtigt fühlen . praktisch .","2. Establishing the European Education Area by 2025 – micro credentials, individual learning accounts and learning for a sustainable environment (debate)",25,False,True,False
158,eu9_31347,2022-05-19,9,Guido Reil,ID,"Sie können Ihre Umverteilungs-Agenda ungestört durchsetzen, und wenn die Jugend dereinst bemerkt, dass sie arm bleibt und den Lebensstandard ihrer Eltern nicht reproduzieren kann, dann werden nicht Sie und Ihre verheerende Politik dafür verantwortlich gemacht, sondern der ach so schwammige Klimawandel, an dem wir doch alle irgendwie schuld sind.","Umverteilungs-Agenda ungestört durchsetzen , Jugend dereinst bemerkt , arm bleibt Lebensstandard Eltern reproduzieren , verheerende Politik verantwortlich , schwammige Klimawandel , irgendwie schuld .","2. Establishing the European Education Area by 2025 – micro credentials, individual learning accounts and learning for a sustainable environment (debate)",25,False,True,False
159,eu9_32219,2022-05-04,9,Gunnar Beck,ID,"Herr Präsident, Frau Kommissarin! Das Wettbewerbsrecht richtet sich gegen Wettbewerbsverzerrungen, einschließlich Subventionen. Subventioniert werden sollen nun aber Klimarettung und der grüne Wandel – ohne Basis in den EU-Verträgen. Denn die grüne Transformation geht weit über Umweltschutz hinaus.",", ! Wettbewerbsrecht richtet Wettbewerbsverzerrungen , einschließlich Subventionen . Subventioniert Klimarettung grüne Wandel   – Basis EU-Verträgen . grüne Transformation Umweltschutz hinaus .",15. Competition policy – annual report 2021 (debate),9,False,True,False
160,eu9_32219,2022-05-04,9,Gunnar Beck,ID,"Zwei Volkswirtschaften werden so geschaffen, eine staatlich und EZB-subventionierte, regulatorisch und zinsbegünstigte grüne Wirtschaft und eine herkömmliche Industrie, für die strenge Regeln gelten, damit auch Anleger grün investieren. Was aber, wenn der Rest der Welt die Klimarettung nicht mitmacht?","Volkswirtschaften geschaffen , staatlich EZB-subventionierte , regulatorisch zinsbegünstigte grüne Wirtschaft herkömmliche Industrie , strenge Regeln gelten , Anleger grün investieren . , Rest Welt Klimarettung mitmacht ?",15. Competition policy – annual report 2021 (debate),9,False,True,False
161,eu9_32219,2022-05-04,9,Gunnar Beck,ID,"Mit einem Anteil an den weltweiten CO2-Emissionen von rund 7 % ist der EU-Einfluss auf das Klima gleich null. Das Ergebnis: Wir zerlegen unsere besten Industrien, in denen wir noch wettbewerbsfähig sind.","Anteil weltweiten CO2-Emissionen 7   % EU-Einfluss Klima null . Ergebnis : zerlegen Industrien , wettbewerbsfähig .",15. Competition policy – annual report 2021 (debate),9,False,True,False
