,speech_id,date,period,speaker,party,text,text_tokenised,agenda,speechnumber,chair,MEP,commission
319,eu9_51250,2020-11-12,9,Joachim Kuhs,ID,"Der Klimawandel ist eine Tatsache, keine Frage, und es hat ihn immer gegeben. Es waren auch immer die Warmzeiten, die die Blütezeiten in der Geschichte waren. Aber was wollen Sie jetzt tun? Ich vertraue lieber auf das Wort, das in Genesis steht, dass eben fortan nicht aufhören soll Saat und Ernte, Frost und Hitze, Sommer und Winter, Tag und Nacht.","Klimawandel Tatsache , Frage , gegeben . Warmzeiten , Blütezeiten Geschichte . ? vertraue Wort , Genesis steht , fortan aufhören Saat Ernte , Frost Hitze , Sommer Winter , Nacht .",8. Sustainable Europe Investment Plan - How to finance the Green Deal (debate),12,False,True,False
320,eu9_51250,2020-11-12,9,Joachim Kuhs,ID,Und ich vertraue lieber diesen Zusagen Gottes als den utopischen Versprechungen der heutigen Klimareligion.,vertraue Zusagen Gottes utopischen Versprechungen heutigen Klimareligion .,8. Sustainable Europe Investment Plan - How to finance the Green Deal (debate),12,False,True,False
321,eu9_51279,2020-11-12,9,Gunnar Beck,ID,"Im Januar schlug die Kommission ihren Plan zur Finanzierung des Green Deal vor, um bis 2030 eine Treibhausgasemissionenreduzierung von 40 % und bis 2050 eine Klimaneutralität zu erreichen. Für etwas so Komplexes wie den Klimawandel würde es die bequeme runde Zahl von 1 Billion Euro kosten. Das sind tausend Milliarden. Wie passend!","Januar schlug Kommission Plan Finanzierung Green Deal , 2030 Treibhausgasemissionenreduzierung 40   % 2050 Klimaneutralität erreichen . Komplexes Klimawandel bequeme runde Zahl 1   Billion Euro kosten . tausend Milliarden . passend !",8. Sustainable Europe Investment Plan - How to finance the Green Deal (debate),41,False,True,False
322,eu9_51490,2020-10-22,9,Guido Reil,ID,"Außerdem betont dieser Bericht, dass wir eine feministische Außen- und Sicherheitspolitik brauchen. Außerdem ist natürlich ganz wichtig, dass wir eine geschlechterspezifische Asyl- und Migrationspolitik fahren. Und selbstverständlich stellen wir uns auch wieder dem Endgegner – dem Klimawandel.","betont Bericht , feministische Außen- Sicherheitspolitik brauchen . wichtig , geschlechterspezifische Asyl- Migrationspolitik fahren . selbstverständlich stellen Endgegner – Klimawandel .",5. Gender Equality in EU’s foreign and security policy (debate),8,False,True,False
323,eu9_51490,2020-10-22,9,Guido Reil,ID,"Wir lernen, dass der Klimawandel besonders frauenfeindlich ist, denn er macht besonders Frauen und Mädchen Probleme.","lernen , Klimawandel frauenfeindlich , Frauen Mädchen Probleme .",5. Gender Equality in EU’s foreign and security policy (debate),8,False,True,False
324,eu9_51490,2020-10-22,9,Guido Reil,ID,"Wenn ich mir jetzt die Aktivistinnen von Fridays for Future ansehe, dann muss ich diesen Eindruck tatsächlich gewinnen, es sind tatsächlich viele Mädchen aktiv, die in der Regel aus sehr gutem Haus kommen, die reich sind, wie zum Beispiel die Sprösslinge der Reedereifamilie Reemtsma. Aber nachvollziehen kann ich das nicht.","Aktivistinnen Fridays for Future ansehe , Eindruck tatsächlich gewinnen , tatsächlich Mädchen aktiv , Regel gutem Haus , reich , Sprösslinge Reedereifamilie Reemtsma . nachvollziehen .",5. Gender Equality in EU’s foreign and security policy (debate),8,False,True,False
325,eu9_51490,2020-10-22,9,Guido Reil,ID,"Warum gerade sind Mädchen und warum gerade sind reiche Mädchen so betroffen? Und gerade vom Klimawandel? Ich habe im Lauf meines Lebens viele Frauen kennengelernt, die allermeisten von ihnen haben es gerne warm, weil Frauen frieren. Erlauben Sie mir diesen kleinen Spaß, denn ich kann den ganzen Wahnsinn schlecht ertragen.","Mädchen reiche Mädchen betroffen ? Klimawandel ? Lauf Lebens Frauen kennengelernt , allermeisten gerne warm , Frauen frieren . Erlauben Spaß , Wahnsinn ertragen .",5. Gender Equality in EU’s foreign and security policy (debate),8,False,True,False
326,eu9_51569,2020-10-22,9,Markus Buchheit,ID,"Herr Präsident, Frau Kommissarin! Welcome back. Schon scheint es, als ob die Fridays for Future-Demos langsam von den Titelseiten der Boulevardblätter verschwunden wären, doch zombieartig hallen ihre Forderungen hier im Alltagsgeschäft der Union fort.",", ! Welcome back . scheint , Fridays for Future-Demos langsam Titelseiten Boulevardblätter verschwunden wären , zombieartig hallen Forderungen Alltagsgeschäft Union fort .",8. Aligning the Energy Charta Treaty with the European Green Deal (debate),6,False,True,False
327,eu9_51569,2020-10-22,9,Markus Buchheit,ID,"Sie verkaufen den Bürgern die vielbeschworene grüne Wende hier als das europäische Men on the Moon-Projekt, als absolute Notwendigkeit – jetzt sofort – mit CO2—Reduktionen von 55 oder 60 %, ganz egal, ohne Folgenabschätzungen, was für Auswirkungen diese Zahlen auf unsere Industrie und Gesellschaft tatsächlich haben werden.","verkaufen Bürgern vielbeschworene grüne Wende europäische Men on the Moon-Projekt , absolute Notwendigkeit   – sofort   – CO2—Reduktionen 55 60   % , egal , Folgenabschätzungen , Auswirkungen Zahlen Industrie Gesellschaft tatsächlich .",8. Aligning the Energy Charta Treaty with the European Green Deal (debate),6,False,True,False
328,eu9_51794,2020-10-20,9,Sylvia Limmer,ID,"Bäuerliche Familienbetriebe, die man zu schützen vorgibt, gehören bald der Vergangenheit an. Die neue GAP – da muss man sich nur die kurze Zusammenfassung der Kommission ansehen, um zu verstehen, wohin die Reise geht. Auf neunzehn Seiten wird erklärt, wie der Landwirt die Umwelt- und Klimaleistung verbessern soll.","Bäuerliche Familienbetriebe , schützen vorgibt , gehören Vergangenheit . GAP – kurze Zusammenfassung Kommission ansehen , verstehen , wohin Reise . neunzehn Seiten erklärt , Landwirt Umwelt- Klimaleistung verbessern .","5. Common agricultural policy - support for strategic plans to be drawn up by Member States and financed by the EAGF and by the EAFRD - Common agricultural policy: financing, management and monitoring - Common agricultural policy – amendment of the CMO and other Regulations (debate)",28,False,True,False
329,eu9_51794,2020-10-20,9,Sylvia Limmer,ID,"Die Hauptpriorität seien ehrgeizigere Ziele beim Klimaschutz, so die Kommission, und die will entgegen anderslautenden Aussagen immer stärker in die nationale Agrarpolitik hineinregieren und fordert von den Mitgliedstaaten Strategiepläne, die zu genehmigen sind.","Hauptpriorität ehrgeizigere Ziele Klimaschutz , Kommission , entgegen anderslautenden Aussagen stärker nationale Agrarpolitik hineinregieren fordert Mitgliedstaaten Strategiepläne , genehmigen .","5. Common agricultural policy - support for strategic plans to be drawn up by Member States and financed by the EAGF and by the EAFRD - Common agricultural policy: financing, management and monitoring - Common agricultural policy – amendment of the CMO and other Regulations (debate)",28,False,True,False
330,eu9_52385,2020-10-07,9,Gunnar Beck,ID,"Frau Präsidentin! Plötzlich soll nach den Nachhaltigkeitskriterien der Kommission alles digital sein: medizinische Versorgung, Bildung, Arbeitswelt, Umweltschutz und der Kampf gegen den Klimawandel. Selbst Frieden, Gendergerechtigkeit und verlorenes Vertrauen in die EU sollen digital gestärkt werden.","! Plötzlich Nachhaltigkeitskriterien Kommission digital : medizinische Versorgung , Bildung , Arbeitswelt , Umweltschutz Kampf Klimawandel . Frieden , Gendergerechtigkeit verlorenes Vertrauen EU digital gestärkt .","15. Digital Finance: emerging risks in crypto-assets - regulatory and supervisory challenges in the area of financial services, institutions and markets - Further development of the Capital Markets Union (CMU): improving access to capital market finance, in particular by SMEs, and further enabling retail investor participation (debate)",8,False,True,False
331,eu9_52542,2020-10-06,9,Sylvia Limmer,ID,"Frau Präsidentin! Das Europäische Klimagesetz: laut Kommission das Herzstück einer – man nennt es inzwischen ganz schamfrei beim Namen – kompletten Transformation nicht nur unserer Wirtschaft, sondern unserer gesamten Gesellschaft.","! Europäische Klimagesetz : laut Kommission Herzstück – nennt inzwischen schamfrei Namen – kompletten Transformation Wirtschaft , gesamten Gesellschaft .",11. European Climate Law (debate),11,False,True,False
332,eu9_52542,2020-10-06,9,Sylvia Limmer,ID,"In Zukunft darf kein Gesetz erlassen werden ohne vorherige Prüfung, ob es sich nicht vielleicht im Widerspruch zu eben jenem Klimagesetz befände. Sogar rückwirkend sollen bereits bestehende Verordnungen geprüft und gegebenenfalls verändert werden. Dieses Gesetz ist das Mutterkorn aller Gesetze: vergiftend und schaurig grün-diktatorisch.","Zukunft Gesetz erlassen vorherige Prüfung , Widerspruch Klimagesetz befände . Sogar rückwirkend bestehende Verordnungen geprüft gegebenenfalls verändert . Gesetz Mutterkorn Gesetze : vergiftend schaurig grün-diktatorisch .",11. European Climate Law (debate),11,False,True,False
333,eu9_52542,2020-10-06,9,Sylvia Limmer,ID,"Statt einen stabilen Rechtsrahmen für eine prosperierende Wirtschaft zu schaffen, überbietet sich eine selbstgefällige, faktenbefreite Notstands-Jammerelite mit „ambitionierten“ Zielen: 40, 55 oder 60 %Treibhausgasreduktion, gerne auch ein wenig mehr. Koste es, was es wolle. Und das darf man hier wörtlich nehmen.","stabilen Rechtsrahmen prosperierende Wirtschaft schaffen , überbietet selbstgefällige , faktenbefreite Notstands-Jammerelite „ ambitionierten “ Zielen : 40 , 55 60   % Treibhausgasreduktion , gerne . Koste , wolle . wörtlich nehmen .",11. European Climate Law (debate),11,False,True,False
334,eu9_52542,2020-10-06,9,Sylvia Limmer,ID,"Als gäbe es weder Chemie noch Physik, schwafelt man von der Verbesserung der Luftqualität bei Treibhausgasreduktion und verschweigt, dass es gewaltig stinkt unter dem angeblich CO2-freien Mantel der erneuerbaren Energien, nicht nur, wenn es um die katastrophalen Abbaubedingungen – weit weg – von Lithium, Kobalt, Mangan und Co. geht.","gäbe weder Chemie Physik , schwafelt Verbesserung Luftqualität Treibhausgasreduktion verschweigt , gewaltig stinkt angeblich CO2-freien Mantel erneuerbaren Energien , , katastrophalen Abbaubedingungen – weg – Lithium , Kobalt , Mangan Co. .",11. European Climate Law (debate),11,False,True,False
335,eu9_52619,2020-10-05,9,Sylvia Limmer,ID,Herr Präsident! Normalerweise würde ich an dieser Stelle im Namen der ID-Fraktion um eine Verschiebung der Abstimmung zum Klimagesetz ersuchen. Coronabedingt sind aber spontane Abstimmungen derzeit nicht möglich.,! Normalerweise Stelle Namen ID-Fraktion Verschiebung Abstimmung Klimagesetz ersuchen . Coronabedingt spontane Abstimmungen derzeit .,14. Order of business,2,False,True,False
336,eu9_52619,2020-10-05,9,Sylvia Limmer,ID,"Daher bleibt mir derzeit nur eine Rüge, dass die Abstimmung zum europäischen Klimagesetz für morgen angesetzt wurde, mit der Bitte, dies im Protokoll anzumerken. Der Grund ist, dass im zuständigen ENVI-Ausschuss trotz eklatanter Rechtsmängel am 10. September eine Abstimmung zu den Änderungsanträgen des Klimagesetzes stattfand.","bleibt derzeit Rüge , Abstimmung europäischen Klimagesetz angesetzt , Bitte , Protokoll anzumerken . Grund , zuständigen ENVI-Ausschuss trotz eklatanter Rechtsmängel 10. September Abstimmung Änderungsanträgen Klimagesetzes stattfand .",14. Order of business,2,False,True,False
337,eu9_52619,2020-10-05,9,Sylvia Limmer,ID,Das von der ID-Fraktion dazu angeforderte Rechtsgutachten vom Juristischen Dienst des Hauses liegt derzeit noch nicht vor. Dennoch wurde die Abstimmung über das Klimagesetz von der Konferenz der Präsidenten – obwohl über die Vorgänge informiert – auf die Tagesordnung gesetzt.,ID-Fraktion angeforderte Rechtsgutachten Juristischen Dienst Hauses liegt derzeit . Dennoch Abstimmung Klimagesetz Konferenz Präsidenten – obwohl Vorgänge informiert – Tagesordnung gesetzt .,14. Order of business,2,False,True,False
338,eu9_53028,2020-09-16,9,Gunnar Beck,ID,"Durch noch mehr Aufgabe von nationaler Souveränität, mehr Ausgaben, mehr Klimapolitik und natürlich: mehr Migration. Corona habe verdeutlicht: Die EU brauche eine gemeinsame Gesundheits- und Sozialpolitik. Verschärfen müsse die EU auch ihre Klimaschutzpolitik und solle ihre CO2-Emissionen bis 2030 nicht um 40 %, sondern um 55 % verringern.","Aufgabe nationaler Souveränität , Ausgaben , Klimapolitik : Migration . Corona verdeutlicht : EU brauche gemeinsame Gesundheits- Sozialpolitik . Verschärfen müsse EU Klimaschutzpolitik solle CO2-Emissionen 2030 40   % , 55   % verringern .",5. State of the Union (topical debate) (continuation of debate),21,False,True,False
339,eu9_53028,2020-09-16,9,Gunnar Beck,ID,"Unerwähnt bleibt, dass die EU nicht einmal 10 % zu den weltweiten CO2-Emissionen beiträgt. Außerdem wolle die EU den Rechtsstaat schützen. Das bedeutet: Maßregelung Polens und Ungarns sowie moralisierende Abwertung der Mächte China und Russland. Und final ein Bekenntnis zur Migration.","Unerwähnt bleibt , EU 10   % weltweiten CO2-Emissionen beiträgt . wolle EU Rechtsstaat schützen . bedeutet : Maßregelung Polens Ungarns moralisierende Abwertung Mächte China Russland . final Bekenntnis Migration .",5. State of the Union (topical debate) (continuation of debate),21,False,True,False
340,eu9_53334,2020-09-14,9,Gunnar Beck,ID,"Herr Präsident, werte Kollegen! Die EU will neue Steuern: EU—Plastiksteuern, Finanzsteuern, CO2-Grenzsteuern und Digitalsteuern. Das EU-Parlament begehrt zudem Eigenmittel aus Unternehmenssteuern. Schon heute haben EU-Staaten die höchsten Steuerquoten der OECD, indes die EU eskalierende Ausgaben vertragswidrig schuldenfinanziert.",", werte ! EU Steuern : EU—Plastiksteuern , Finanzsteuern , CO2-Grenzsteuern Digitalsteuern . EU-Parlament begehrt zudem Eigenmittel Unternehmenssteuern . EU-Staaten höchsten Steuerquoten OECD , indes EU eskalierende Ausgaben vertragswidrig schuldenfinanziert .",21. Draft Council decision on the system of own resources of the European Union (continuation of debate),25,False,True,False
341,eu9_53986,2020-06-19,9,Christine Anderson,ID,"Wie in vielen anderen Debatten überschätzt dieses sogenannte Parlament aber auch hier nachhaltig seine Kompetenz, denn solange der Amazonas nicht Teil der EU ist, sollten wir eher den Blick auf unsere Mitgliedstaaten werfen, wo nichts anderes regelmäßig passiert und Landraub und Abholzung unternommen werden, um eine angebliche Energiewende, die","Debatten überschätzt sogenannte Parlament nachhaltig Kompetenz , solange Amazonas EU , eher Blick Mitgliedstaaten werfen , anderes regelmäßig passiert Landraub Abholzung unternommen , angebliche Energiewende ,",4. Land grabbing and deforestation in the Amazonas (debate),35,False,True,False
342,eu9_54560,2020-05-14,9,Guido Reil,ID,Im Grunde genommen wurden die deutsche und die französische Kohle- und Stahlindustrie der nationalen Kontrolle entzogen und einer gemeinsamen europäischen Behörde unterstellt. Damit wurde der Frieden in Europa gesichert.,Grunde genommen deutsche französische Kohle- Stahlindustrie nationalen Kontrolle entzogen gemeinsamen europäischen Behörde unterstellt . Frieden Europa gesichert .,7. 70th anniversary of the Schuman Declaration (debate),39,False,True,False
343,eu9_54745,2020-05-13,9,Christine Anderson,ID,"Der European Green Deal ist ein von der Europäischen Kommission vorgestelltes Konzept mit dem Ziel, bis 2050 in der Europäischen Union die Nettoemissionen von Treibhausgasen auf null zu reduzieren und somit als erster Kontinent klimaneutral zu werden. Die Volkswirtschaften sind aufgrund des „Shutdown“ auf Talfahrt.","European Green Deal Europäischen Kommission vorgestelltes Konzept Ziel , 2050 Europäischen Union Nettoemissionen Treibhausgasen null reduzieren somit Kontinent klimaneutral . Volkswirtschaften aufgrund „ Shutdown “ Talfahrt .","17. Conclusions of the extraordinary European Council meeting of 23 April 2020 - New MFF, own resources and Recovery plan (debate)",86,False,True,False
344,eu9_54745,2020-05-13,9,Christine Anderson,ID,"Woher sollen 1 Billion Euro kommen, um eine völlig faktenbefreite und irrsinnige Klima-Wahn-Ideologie zu finanzieren? Trotzdem will die Kommission stur an ihrem „Green Deal“ festhalten.","Woher 1 Billion Euro , völlig faktenbefreite irrsinnige Klima-Wahn-Ideologie finanzieren ? Kommission stur „ Green Deal “ festhalten .","17. Conclusions of the extraordinary European Council meeting of 23 April 2020 - New MFF, own resources and Recovery plan (debate)",86,False,True,False
345,eu9_54812,2020-04-16,9,Gunnar Beck,ID,"Ludwig jagte, wir debattieren: im Januar über Green Deal, Klimarettung und die Zukunft Europas und im Februar noch übers dritte Geschlecht und Menschenrechte in Madagaskar. Ein Spitzenbeamter in Madrid bemerkte gar gelassen – im Februar wohlgemerkt –, er erwarte nur eine Handvoll Corona-Infizierter.","Ludwig jagte , debattieren : Januar Green Deal , Klimarettung Zukunft Europas Februar übers Geschlecht Menschenrechte Madagaskar . Spitzenbeamter Madrid bemerkte gelassen –   Februar wohlgemerkt   – , erwarte Handvoll Corona-Infizierter .",17. EU coordinated action to combat the COVID-19 pandemic and its consequences (continuation of debate),28,False,True,False
346,eu9_54812,2020-04-16,9,Gunnar Beck,ID,"Asyl für die Welt, Klimanotstand und Genderwahn sind kollektive Symptome eines neurotischen Ausweichens vor der Mühsal der Selbstbehauptung und der Allmachtsfantasien eines ohnmächtigen Patienten: Europas Flucht in die Krankheit. Die Corona-Krise stellt klar: Europa ist krank und daher für Krankheiten anfälliger.","Asyl Welt , Klimanotstand Genderwahn kollektive Symptome neurotischen Ausweichens Mühsal Selbstbehauptung Allmachtsfantasien ohnmächtigen Patienten : Europas Flucht Krankheit . Corona-Krise stellt klar : Europa krank Krankheiten anfälliger .",17. EU coordinated action to combat the COVID-19 pandemic and its consequences (continuation of debate),28,False,True,False
347,eu9_54955,2020-03-26,9,Maximilian Krah,ID,"Wir werden uns die Frage stellen müssen: Ist nicht diese konkrete Hilfe wichtiger als ein Grüner Deal? Ist es nicht an der Zeit zu überlegen, ob dasjenige, was uns hier so lieb und teuer ist – vom Klimanotstand bis zur Gender-Strategie –, ob das nicht weniger wichtig ist als die konkrete Hilfe?","Frage stellen : konkrete Hilfe wichtiger Grüner Deal ? überlegen , dasjenige , lieb teuer   – Klimanotstand Gender-Strategie   – , wichtig konkrete Hilfe ?",19. European coordinated response to the COVID-19 outbreak (debate),26,False,True,False
348,eu9_56528,2020-02-10,9,Markus Buchheit,ID,"Wir wissen auch seit Jahren, wo die Probleme im Bereich der kleinen und mittelständischen Unternehmen liegen, nämlich insbesondere im Bereich der steuerlichen Belastungen und der Bürokratie. Der Green Deal und die CO2—Steuer belasten den Mittelstand in den kommenden Jahren immer mehr.","wissen , Probleme Bereich mittelständischen Unternehmen liegen , nämlich insbesondere Bereich steuerlichen Belastungen Bürokratie . Green Deal CO2—Steuer belasten Mittelstand kommenden .",13. SMEs and better regulation (debate),33,False,True,False
349,eu9_56558,2020-02-10,9,Markus Buchheit,ID,"Wenn ich höre, dass den Grünen zu viele Gasvorhaben in das TEN-E-Programm einbezogen werden, aus der gleichen Gruppe dann aber auch die Forderung nach der Abschaltung von Kohlekraftwerken kommt und in Ländern wie Deutschland auch der Atomstrom vor dem Aus steht, dann frage ich mich, ob Sie die Versorgung der Verbraucher einzig und allein den Launen","höre , Grünen Gasvorhaben TEN-E-Programm einbezogen , gleichen Gruppe Forderung Abschaltung Kohlekraftwerken Ländern Deutschland Atomstrom steht , frage , Versorgung Verbraucher einzig Launen",14. Revision of the guidelines for trans-European energy infrastructure - Objection pursuant to Rule 111: Union list of projects of common interest (debate),8,False,True,False
350,eu9_57642,2020-01-15,9,Sylvia Limmer,ID,"Mich treibt Grundsätzlicheres um: Umweltschutz war gestern, heute wird lieber scheinheilig das Klima gerettet – mit fatalen Folgen für die Umwelt, was die Klimaendzeitjünger wenig kümmert.","treibt Grundsätzlicheres : Umweltschutz gestern , scheinheilig Klima gerettet – fatalen Folgen Umwelt , Klimaendzeitjünger kümmert .",19. COP15 to the Convention on Biological Diversity (Kunming 2020) (debate),15,False,True,False
351,eu9_57642,2020-01-15,9,Sylvia Limmer,ID,"Dass der Klimareligion Landschaftsschutz und vor allem viele Waldflächen für Windindustrieanlagen zum Opfer fallen, quittieren Gretas Truppen mit erstaunlichem ökologischen Gleichmut.","Klimareligion Landschaftsschutz Waldflächen Windindustrieanlagen Opfer fallen , quittieren Gretas Truppen erstaunlichem ökologischen Gleichmut .",19. COP15 to the Convention on Biological Diversity (Kunming 2020) (debate),15,False,True,False
352,eu9_57642,2020-01-15,9,Sylvia Limmer,ID,"toxische Abraumprodukte in China anfallen, und jammern stattdessen in altbewährter Manier über die angeblichen Belastungen für die biologische Vielfalt durch den Klimawandel. Ich darf an dieser Stelle daran erinnern, dass die Evolution und die Veränderung der Biosphäre seit jeher die Regel und nicht die Ausnahme waren.","toxische Abraumprodukte China anfallen , jammern stattdessen altbewährter Manier angeblichen Belastungen biologische Vielfalt Klimawandel . Stelle erinnern , Evolution Veränderung Biosphäre jeher Regel Ausnahme .",19. COP15 to the Convention on Biological Diversity (Kunming 2020) (debate),15,False,True,False
353,eu9_57758,2020-01-14,9,Maximilian Krah,ID,"Die Europäische Union zurzeit ist der große globale Wirtschaftsraum mit der niedrigsten Wachstumsleistung, sie hat die niedrigste Investitionskraft, will aber drei Billionen Euro für Klimawandel ausgeben, was nicht unbedingt eine Zukunftstechnologie ist, auch wenn die Mehrheit das hier anders sieht.","Europäische Union zurzeit globale Wirtschaftsraum niedrigsten Wachstumsleistung , niedrigste Investitionskraft , Billionen Euro Klimawandel ausgeben , unbedingt Zukunftstechnologie , Mehrheit sieht .",2. Presentation of the programme of activities of the Croatian Presidency (debate),41,False,True,False
354,eu9_57890,2020-01-14,9,Guido Reil,ID,"Frau Präsidentin, liebe Kolleginnen und Kollegen! Der Grüne Deal ist das unsozialste Projekt in der Geschichte der Europäischen Union, und wer glaubt, den Niedergang von Kohleregionen mit Geld, mit Strukturhilfen verhindern zu können, der hat aus der Geschichte und aus der Vergangenheit nichts gelernt.",", liebe Kolleginnen ! Grüne Deal unsozialste Projekt Geschichte Europäischen Union , glaubt , Niedergang Kohleregionen Geld , Strukturhilfen verhindern , Geschichte Vergangenheit gelernt .","6. Sustainable investment plan, just transition fund and Roadmap on Social Europe (debate)",34,False,True,False
355,eu9_57890,2020-01-14,9,Guido Reil,ID,"In meiner Geburtsstadt Gelsenkirchen gibt es die höchste Arbeitslosenquote in Deutschland, es gibt die meisten armen Kinder, und es gibt die meisten armen Alten. In den ehemaligen Kohleregionen in Belgien, in Frankreich und in England sieht es genauso aus, da müssen wir uns doch nichts vormachen, guckt es euch an!","Geburtsstadt Gelsenkirchen höchste Arbeitslosenquote Deutschland , meisten armen Kinder , meisten armen Alten . ehemaligen Kohleregionen Belgien , Frankreich England sieht genauso , vormachen , guckt !","6. Sustainable investment plan, just transition fund and Roadmap on Social Europe (debate)",34,False,True,False
356,eu9_58206,2020-01-13,9,Sylvia Limmer,ID,"Frau Präsidentin! Was mich am allermeisten bei der Diskussion stört, ist die sensationsgeile Zufriedenheit linksgrüner Klimaneurotiker bezüglich der schrecklichen Brände in Australien nach dem Motto: Hier ist endlich der Beweis menschengemachten Klimawandels. Schämen Sie sich, und zwar bitte kräftig.","! allermeisten Diskussion stört , sensationsgeile Zufriedenheit linksgrüner Klimaneurotiker bezüglich schrecklichen Brände Australien Motto : Beweis menschengemachten Klimawandels . Schämen , bitte kräftig .",13. Devastating Bushfires in Australia and other extreme weather events as a consequence of Climate Change (debate),8,False,True,False
357,eu9_59493,2019-12-11,9,Markus Buchheit,ID,Doch allein die EU wird den Klimawandel nicht aufhalten – gerade einmal 10 % der globalen Emissionen sind tatsächlich in der EU gemacht. Allein die Inbetriebnahme von 300 neuen Kohlekraftwerken in China wird alle harten und teuren Einsparungen der EU obsolet werden lassen.,EU Klimawandel aufhalten – 10   % globalen Emissionen tatsächlich EU . Inbetriebnahme 300 Kohlekraftwerken China harten teuren Einsparungen EU obsolet lassen .,7. The European Green Deal (debate),25,False,True,False
358,eu9_59493,2019-12-11,9,Markus Buchheit,ID,"Ob die Maßnahmen des Green Deal also letztlich dem Weltklima nutzen werden, das steht in den Sternen. Sicher hingegen ist momentan vor allem eines, nämlich die weitere Belastung und Gängelung unserer Bürger für Energie und für Fortbewegung.","Maßnahmen Green Deal letztlich Weltklima nutzen , steht Sternen . Sicher hingegen momentan , nämlich Belastung Gängelung Bürger Energie Fortbewegung .",7. The European Green Deal (debate),25,False,True,False
